{
  "schema_version": 1,
  "reservations": [
    {
      "kind": "dining",
      "title": "Dinner at Le Comptoir des Tanneurs",
      "provider": "TheFork",
      "booking_ref": "038557076",
      "status": "confirmed",
      "starts_at_local": "2027-05-22T20:00:00",
      "ends_at_local": null,
      "start_place": {
        "name": "Le Comptoir des Tanneurs",
        "address": "18 rue de la Folie-Méricourt, 75011 Paris",
        "iata": null,
        "city": "Paris",
        "country": "FR"
      },
      "end_place": null,
      "travellers": [
        { "name": "Quentin Laurent", "type": null }
      ],
      "price": null,
      "cancellation": "Vous pouvez modifier ou annuler votre réservation gratuitement jusqu'à 2 heures avant l'heure prévue, depuis l'application ou le site TheFork. En cas d'empêchement de dernière minute, merci de prévenir directement le restaurant par téléphone.",
      "details": {
        "party_size": 2,
        "phone": "+33 1 99 00 27 84"
      },
      "confidence": {
        "kind": 1.0,
        "title": 1.0,
        "provider": 1.0,
        "booking_ref": 1.0,
        "status": 1.0,
        "starts_at_local": 1.0,
        "start_place": 1.0,
        "travellers": 1.0,
        "cancellation": 1.0,
        "details": 1.0
      }
    }
  ],
  "trip_hint": {
    "destination": "Paris",
    "country": "FR",
    "starts_on": "2027-05-22",
    "ends_on": "2027-05-22"
  },
  "notes": "TheFork offer applied: 30% off the à la carte menu, drinks excluded, deducted from the bill at the restaurant."
}
