{
  "schema_version": 1,
  "reservations": [
    {
      "kind": "flight",
      "title": "New York to Honolulu via Los Angeles",
      "provider": "Delta Air Lines",
      "booking_ref": "OG9A2K",
      "status": "confirmed",
      "starts_at_local": "2027-04-22T07:00:00",
      "ends_at_local": "2027-04-22T15:25:00",
      "start_place": {
        "name": "New York-Kennedy",
        "address": null,
        "iata": "JFK",
        "city": "New York",
        "country": "US"
      },
      "end_place": {
        "name": null,
        "address": null,
        "iata": "HNL",
        "city": "Honolulu",
        "country": "US"
      },
      "travellers": [
        { "name": "Arjun Mehta", "type": null },
        { "name": "Priya Mehta", "type": null }
      ],
      "price": { "amount": "1214.40", "currency": "USD" },
      "cancellation": "This ticket is non-refundable. Main Cabin tickets have no change fee for travel originating in the U.S.; a difference in fare may apply. If you cancel before departure, the value of your ticket may be applied toward future travel as an eCredit.",
      "details": {
        "number": "DL 422",
        "carrier": "Delta Air Lines",
        "from_iata": "JFK",
        "to_iata": "HNL",
        "seat": "23A, 23B",
        "cabin": "Main Cabin",
        "terminal": null,
        "gate": null,
        "legs": [
          {
            "number": "DL 422",
            "carrier": "Delta Air Lines",
            "from_iata": "JFK",
            "to_iata": "LAX",
            "departs_at_local": "2027-04-22T07:00:00",
            "arrives_at_local": "2027-04-22T10:21:00",
            "seat": "23A, 23B",
            "cabin": "Main Cabin",
            "terminal": null
          },
          {
            "number": "DL 1561",
            "carrier": "Delta Air Lines",
            "from_iata": "LAX",
            "to_iata": "HNL",
            "departs_at_local": "2027-04-22T12:35:00",
            "arrives_at_local": "2027-04-22T15:25:00",
            "seat": "31A, 31B",
            "cabin": "Main Cabin",
            "terminal": null
          }
        ]
      },
      "confidence": {
        "kind": 1.0,
        "title": 1.0,
        "provider": 1.0,
        "booking_ref": 1.0,
        "status": 1.0,
        "starts_at_local": 1.0,
        "ends_at_local": 1.0,
        "start_place": 1.0,
        "end_place": 1.0,
        "travellers": 1.0,
        "price": 1.0,
        "cancellation": 1.0,
        "details": 1.0
      }
    }
  ],
  "trip_hint": {
    "destination": "Honolulu",
    "country": "US",
    "starts_on": "2027-04-22",
    "ends_on": null
  },
  "notes": null
}
