{
  "schema_version": 1,
  "reservations": [
    {
      "kind": "flight",
      "title": "Barcelona to Rome",
      "provider": "Vueling",
      "booking_ref": "V7IXQB",
      "status": "cancelled",
      "starts_at_local": "2027-08-18T18:40:00",
      "ends_at_local": "2027-08-18T20:30:00",
      "start_place": {
        "name": null,
        "address": null,
        "iata": "BCN",
        "city": "Barcelona",
        "country": "ES"
      },
      "end_place": {
        "name": null,
        "address": null,
        "iata": "FCO",
        "city": "Rome",
        "country": "IT"
      },
      "travellers": [
        { "name": "Sofia Quintero", "type": null },
        { "name": "Mateo Morales", "type": null }
      ],
      "price": null,
      "cancellation": "Cambiar tu vuelo sin coste: puedes elegir otro vuelo de Vueling en la misma ruta, con salida hasta 30 días después de la fecha original. Solicitar el reembolso: te devolveremos el importe íntegro de tu reserva en el medio de pago original en un plazo máximo de 7 días.",
      "details": {
        "number": "VY 6104",
        "carrier": "Vueling",
        "from_iata": "BCN",
        "to_iata": "FCO",
        "seat": null,
        "cabin": null,
        "terminal": "1",
        "gate": null,
        "legs": null
      },
      "confidence": {
        "kind": 1.0,
        "title": 1.0,
        "provider": 1.0,
        "booking_ref": 1.0,
        "status": 1.0,
        "starts_at_local": 1.0,
        "ends_at_local": 1.0,
        "start_place": 1.0,
        "end_place": 1.0,
        "travellers": 1.0,
        "cancellation": 1.0,
        "details": 1.0
      }
    }
  ],
  "trip_hint": {
    "destination": "Rome",
    "country": "IT",
    "starts_on": "2027-08-18",
    "ends_on": null
  },
  "notes": "Cancelled by the airline; no replacement flight is booked yet. The passenger must choose a free change or a full refund by 15/09/2027."
}
