{
  "schema_version": 1,
  "reservations": [
    {
      "kind": "flight",
      "title": "Barcelona to Paris",
      "provider": "eDreams",
      "booking_ref": "T0AT6F",
      "status": "confirmed",
      "starts_at_local": "2027-03-12T10:05:00",
      "ends_at_local": "2027-03-12T12:00:00",
      "start_place": {
        "name": "Barcelona El Prat",
        "address": null,
        "iata": "BCN",
        "city": "Barcelona",
        "country": "ES"
      },
      "end_place": {
        "name": "París Orly",
        "address": null,
        "iata": "ORY",
        "city": "Paris",
        "country": "FR"
      },
      "travellers": [
        { "name": "Mateo Castellano", "type": "adult" }
      ],
      "price": { "amount": "81.44", "currency": "EUR" },
      "cancellation": "Cambios: puedes solicitar un cambio desde tu área de cliente; se aplicarán las condiciones de la aerolínea y la diferencia de precio. Cancelaciones: esta tarifa no es reembolsable. Si cancelas, solo podrás recuperar las tasas aeroportuarias no utilizadas. La tarifa de servicio de eDreams no es reembolsable.",
      "details": {
        "number": "VY 8012",
        "carrier": "Vueling",
        "from_iata": "BCN",
        "to_iata": "ORY",
        "seat": null,
        "cabin": "Económica",
        "terminal": "1",
        "gate": null,
        "legs": null
      },
      "confidence": {
        "kind": 1.0,
        "title": 1.0,
        "provider": 1.0,
        "booking_ref": 1.0,
        "status": 1.0,
        "starts_at_local": 1.0,
        "ends_at_local": 1.0,
        "start_place": 1.0,
        "end_place": 1.0,
        "travellers": 1.0,
        "price": 1.0,
        "cancellation": 1.0,
        "details": 1.0
      }
    }
  ],
  "trip_hint": {
    "destination": "Paris",
    "country": "FR",
    "starts_on": "2027-03-12",
    "ends_on": null
  },
  "notes": "eDreams booking number 3555492132."
}
