{
  "schema_version": 1,
  "reservations": [
    {
      "kind": "lodging",
      "title": "Vltava Loft Hostel",
      "provider": "Hostelworld",
      "booking_ref": "64869-879310206",
      "status": "confirmed",
      "starts_at_local": "2027-06-24T14:00:00",
      "ends_at_local": "2027-06-27T10:00:00",
      "start_place": {
        "name": "Vltava Loft Hostel",
        "address": "Na Poříčí 1047/26, 110 00 Praha 1, Czech Republic",
        "iata": null,
        "city": "Prague",
        "country": "CZ"
      },
      "end_place": null,
      "travellers": [
        { "name": "Tarik Aydin", "type": null }
      ],
      "price": { "amount": "1890.00", "currency": "CZK" },
      "cancellation": "Standard booking: the deposit is non-refundable. Cancel up to 2 days before arrival and you will not be charged anything else. If you cancel later or do not show up, the property may charge the first night.",
      "details": {
        "room": "6 Bed Mixed Dorm Ensuite",
        "guests": 1,
        "address": "Na Poříčí 1047/26, 110 00 Praha 1, Czech Republic",
        "phone": "+420 224 813 552",
        "checkin_time": "14:00",
        "checkout_time": "10:00"
      },
      "confidence": {
        "kind": 1.0,
        "title": 1.0,
        "provider": 1.0,
        "booking_ref": 1.0,
        "status": 1.0,
        "starts_at_local": 1.0,
        "ends_at_local": 1.0,
        "start_place": 1.0,
        "travellers": 1.0,
        "price": 1.0,
        "cancellation": 1.0,
        "details": 1.0
      }
    }
  ],
  "trip_hint": {
    "destination": "Prague",
    "country": "CZ",
    "starts_on": "2027-06-24",
    "ends_on": "2027-06-27"
  },
  "notes": "A 15% deposit of CZK 283.50 was paid online (charged as EUR 11.30); the balance of CZK 1,606.50 and city tax of CZK 50 per person per night are paid at the hostel."
}
