{
  "schema_version": 1,
  "reservations": [
    {
      "kind": "lodging",
      "title": "Hotel Am Naschmarkt",
      "provider": "Hotels.com",
      "booking_ref": "9624613121712",
      "status": "confirmed",
      "starts_at_local": "2027-03-03T14:00:00",
      "ends_at_local": "2027-03-06T12:00:00",
      "start_place": {
        "name": "Hotel Am Naschmarkt",
        "address": "Linke Wienzeile 34, 1060 Wien, Österreich",
        "iata": null,
        "city": "Vienna",
        "country": "AT"
      },
      "end_place": null,
      "travellers": [
        { "name": "Lena Weissmann", "type": null }
      ],
      "price": { "amount": "450.98", "currency": "EUR" },
      "cancellation": "Kostenlose Stornierung bis So., 28.02.2027, 23:59 Uhr (Ortszeit der Unterkunft). Bei Stornierungen oder Änderungen nach 23:59 Uhr (Mitteleuropäische Zeit) am 28. Februar 2027 oder bei Nichtanreise berechnet die Unterkunft eine Gebühr in Höhe von 100 % des Gesamtbetrags der Buchung.",
      "details": {
        "room": "Doppelzimmer Superior, 1 Doppelbett",
        "guests": 2,
        "address": "Linke Wienzeile 34, 1060 Wien, Österreich",
        "phone": "+43 1 586 2210",
        "checkin_time": "14:00",
        "checkout_time": "12:00"
      },
      "confidence": {
        "kind": 1.0,
        "title": 1.0,
        "provider": 1.0,
        "booking_ref": 1.0,
        "status": 1.0,
        "starts_at_local": 1.0,
        "ends_at_local": 1.0,
        "start_place": 1.0,
        "travellers": 1.0,
        "price": 1.0,
        "cancellation": 1.0,
        "details": 1.0
      }
    }
  ],
  "trip_hint": {
    "destination": "Vienna",
    "country": "AT",
    "starts_on": "2027-03-03",
    "ends_on": "2027-03-06"
  },
  "notes": null
}
