{
  "schema_version": 1,
  "reservations": [
    {
      "kind": "lodging",
      "title": "Sunny loft with river view in Alfama",
      "provider": "Airbnb",
      "booking_ref": "XIV7KP3C0L",
      "status": "confirmed",
      "starts_at_local": "2027-07-15T16:00:00",
      "ends_at_local": "2027-07-19T11:00:00",
      "start_place": {
        "name": "Sunny loft with river view in Alfama",
        "address": "Rua de São Miguel 18, 1100-544 Lisboa, Portugal",
        "iata": null,
        "city": "Lisbon",
        "country": "PT"
      },
      "end_place": null,
      "travellers": [
        { "name": "Mira Kowalczyk", "type": null }
      ],
      "price": { "amount": "976.94", "currency": "EUR" },
      "cancellation": "Free cancellation before 16:00 on 10 Jul. Cancel before check-in on 15 Jul for a partial refund. Review the Host's full cancellation policy, which applies even if you cancel for illness or disruptions.",
      "details": {
        "room": "Entire rental unit",
        "guests": 4,
        "address": "Rua de São Miguel 18, 1100-544 Lisboa, Portugal",
        "phone": null,
        "checkin_time": "16:00",
        "checkout_time": "11:00"
      },
      "confidence": {
        "kind": 1.0,
        "title": 1.0,
        "provider": 1.0,
        "booking_ref": 1.0,
        "status": 1.0,
        "starts_at_local": 1.0,
        "ends_at_local": 1.0,
        "start_place": 1.0,
        "travellers": 1.0,
        "price": 1.0,
        "cancellation": 1.0,
        "details": 1.0
      }
    }
  ],
  "trip_hint": {
    "destination": "Lisbon",
    "country": "PT",
    "starts_on": "2027-07-15",
    "ends_on": "2027-07-19"
  },
  "notes": "Hosted by Ines; the host sends check-in details before arrival."
}
