{
  "schema_version": 1,
  "reservations": [
    {
      "kind": "rail",
      "title": "London to Paris",
      "provider": "Eurostar",
      "booking_ref": "SOSBOK",
      "status": "confirmed",
      "starts_at_local": "2027-07-08T09:01:00",
      "ends_at_local": "2027-07-08T12:20:00",
      "start_place": {
        "name": "London St Pancras International",
        "address": null,
        "iata": null,
        "city": "London",
        "country": "GB"
      },
      "end_place": {
        "name": "Paris Gare du Nord",
        "address": null,
        "iata": null,
        "city": "Paris",
        "country": "FR"
      },
      "travellers": [
        { "name": "Callum Gallagher", "type": "adult" },
        { "name": "Nadia Haddad", "type": "adult" }
      ],
      "price": { "amount": "178.00", "currency": "GBP" },
      "cancellation": "Exchanges are free of charge up to 7 days before departure. From 7 days before departure until 1 hour after departure, you can exchange for a fee of £15 per person plus any difference in fare. Standard tickets are non-refundable.",
      "details": {
        "train": "9014",
        "coach": "12",
        "seat": "41, 42",
        "platform": null
      },
      "confidence": {
        "kind": 1.0,
        "title": 1.0,
        "provider": 1.0,
        "booking_ref": 1.0,
        "status": 1.0,
        "starts_at_local": 1.0,
        "ends_at_local": 1.0,
        "start_place": 1.0,
        "end_place": 1.0,
        "travellers": 1.0,
        "price": 1.0,
        "cancellation": 1.0,
        "details": 1.0
      }
    }
  ],
  "trip_hint": {
    "destination": "Paris",
    "country": "FR",
    "starts_on": "2027-07-08",
    "ends_on": null
  },
  "notes": null
}
