{
  "schema_version": 1,
  "reservations": [
    {
      "kind": "flight",
      "title": "Rome to Palermo",
      "provider": "ITA Airways",
      "booking_ref": "PL8K9Q",
      "status": "confirmed",
      "starts_at_local": "2027-04-24T13:15:00",
      "ends_at_local": "2027-04-24T14:25:00",
      "start_place": {
        "name": "Roma Fiumicino",
        "address": null,
        "iata": "FCO",
        "city": "Rome",
        "country": "IT"
      },
      "end_place": {
        "name": null,
        "address": null,
        "iata": "PMO",
        "city": "Palermo",
        "country": "IT"
      },
      "travellers": [
        { "name": "Chiara Rinaldi", "type": "adult" },
        { "name": "Dario Rinaldi", "type": "adult" }
      ],
      "price": { "amount": "194.94", "currency": "EUR" },
      "cancellation": "La tariffa Classic consente il cambio data con penale di 50 € a passeggero, oltre all'eventuale differenza tariffaria. In caso di cancellazione il biglietto non è rimborsabile; puoi richiedere il rimborso delle tasse aeroportuali non utilizzate.",
      "details": {
        "number": "AZ 1779",
        "carrier": "ITA Airways",
        "from_iata": "FCO",
        "to_iata": "PMO",
        "seat": "18A, 18B",
        "cabin": "Economy",
        "terminal": "1",
        "gate": null,
        "legs": null
      },
      "confidence": {
        "kind": 1.0,
        "title": 1.0,
        "provider": 1.0,
        "booking_ref": 1.0,
        "status": 1.0,
        "starts_at_local": 1.0,
        "ends_at_local": 1.0,
        "start_place": 1.0,
        "end_place": 1.0,
        "travellers": 1.0,
        "price": 1.0,
        "cancellation": 1.0,
        "details": 1.0
      }
    }
  ],
  "trip_hint": {
    "destination": "Palermo",
    "country": "IT",
    "starts_on": "2027-04-24",
    "ends_on": null
  },
  "notes": null
}
