{
  "schema_version": 1,
  "reservations": [
    {
      "kind": "flight",
      "title": "London to Barcelona",
      "provider": "Expedia",
      "booking_ref": "M7PKTZ",
      "status": "confirmed",
      "starts_at_local": "2027-06-11T07:15:00",
      "ends_at_local": "2027-06-11T10:20:00",
      "start_place": {
        "name": null,
        "address": null,
        "iata": "LHR",
        "city": "London",
        "country": "GB"
      },
      "end_place": {
        "name": null,
        "address": null,
        "iata": "BCN",
        "city": "Barcelona",
        "country": "ES"
      },
      "travellers": [
        { "name": "Arjun Kaplan", "type": "adult" },
        { "name": "Ines Oliveira", "type": "adult" }
      ],
      "price": null,
      "cancellation": "Tickets are non-refundable. Changes are permitted for a fee charged by the airline, plus any difference in fare.",
      "details": {
        "number": "BA 478",
        "carrier": "British Airways",
        "from_iata": "LHR",
        "to_iata": "BCN",
        "seat": null,
        "cabin": "Economy",
        "terminal": "5",
        "gate": null,
        "legs": null
      },
      "confidence": {
        "kind": 1.0,
        "title": 1.0,
        "provider": 1.0,
        "booking_ref": 1.0,
        "status": 1.0,
        "starts_at_local": 1.0,
        "ends_at_local": 1.0,
        "start_place": 1.0,
        "end_place": 1.0,
        "travellers": 1.0,
        "cancellation": 1.0,
        "details": 1.0
      }
    },
    {
      "kind": "flight",
      "title": "Barcelona to London",
      "provider": "Expedia",
      "booking_ref": "M7PKTZ",
      "status": "confirmed",
      "starts_at_local": "2027-06-14T11:25:00",
      "ends_at_local": "2027-06-14T12:45:00",
      "start_place": {
        "name": null,
        "address": null,
        "iata": "BCN",
        "city": "Barcelona",
        "country": "ES"
      },
      "end_place": {
        "name": null,
        "address": null,
        "iata": "LHR",
        "city": "London",
        "country": "GB"
      },
      "travellers": [
        { "name": "Arjun Kaplan", "type": "adult" },
        { "name": "Ines Oliveira", "type": "adult" }
      ],
      "price": null,
      "cancellation": "Tickets are non-refundable. Changes are permitted for a fee charged by the airline, plus any difference in fare.",
      "details": {
        "number": "BA 479",
        "carrier": "British Airways",
        "from_iata": "BCN",
        "to_iata": "LHR",
        "seat": null,
        "cabin": "Economy",
        "terminal": "1",
        "gate": null,
        "legs": null
      },
      "confidence": {
        "kind": 1.0,
        "title": 1.0,
        "provider": 1.0,
        "booking_ref": 1.0,
        "status": 1.0,
        "starts_at_local": 1.0,
        "ends_at_local": 1.0,
        "start_place": 1.0,
        "end_place": 1.0,
        "travellers": 1.0,
        "cancellation": 1.0,
        "details": 1.0
      }
    },
    {
      "kind": "lodging",
      "title": "Hotel Mirador Eixample",
      "provider": "Expedia",
      "booking_ref": "74893401",
      "status": "confirmed",
      "starts_at_local": "2027-06-11T15:00:00",
      "ends_at_local": "2027-06-14T12:00:00",
      "start_place": {
        "name": "Hotel Mirador Eixample",
        "address": "Carrer d'Aragó 271, Barcelona, Catalonia, 08007 Spain",
        "iata": null,
        "city": "Barcelona",
        "country": "ES"
      },
      "end_place": null,
      "travellers": [
        { "name": "Arjun Kaplan", "type": null }
      ],
      "price": null,
      "cancellation": "This reservation is non-refundable. If you change or cancel your booking you will not get a refund or credit to use for a future stay.",
      "details": {
        "room": "Superior Double Room, 1 double bed",
        "guests": 2,
        "address": "Carrer d'Aragó 271, Barcelona, Catalonia, 08007 Spain",
        "phone": "+34 934 87 22 10",
        "checkin_time": "15:00",
        "checkout_time": "12:00"
      },
      "confidence": {
        "kind": 1.0,
        "title": 1.0,
        "provider": 1.0,
        "booking_ref": 1.0,
        "status": 1.0,
        "starts_at_local": 1.0,
        "ends_at_local": 1.0,
        "start_place": 1.0,
        "travellers": 1.0,
        "cancellation": 1.0,
        "details": 1.0
      }
    }
  ],
  "trip_hint": {
    "destination": "Barcelona",
    "country": "ES",
    "starts_on": "2027-06-11",
    "ends_on": "2027-06-14"
  },
  "notes": "Flight + Hotel package with one total of £1,148.60 (1148.60 GBP) for both flights and the hotel, not broken down by component. Expedia itinerary number 5317024009651."
}
